{
  "$schema": "http://json-schema.org/draft-04/schema",
  "id": "http://uk/gov/hmrc/trustregistration/raml/schemas/beneficiaries.json",
  "title": "Get Beneficiaries",
  "description": "A JSON response for all beneficiaries of any trust type with HATEOAS links for further actions",
  "type": "object",
  "properties": {
    "individualBeneficiaries": {
      "$ref": "#/definitions/individualBeneficiaries"
    },
    "employeeBeneficiaries": {
      "$ref": "#/definitions/individualBeneficiaries"
    },
    "directorBeneficiaries": {
      "$ref": "#/definitions/individualBeneficiaries"
    },
    "charityBeneficiaries": {
      "$ref": "#/definitions/charityBeneficiaries"
    },
    "otherBeneficiaries": {
      "$ref": "#/definitions/otherBeneficiaries"
    },
    "_links": {
      "type": "object",
      "properties": {
        "self": {
          "type": "object",
          "properties": {
            "href": {
              "type": "string"
            }
          },
          "required": [
            "href"
          ]
        },
        "trust": {
          "type": "object",
          "properties": {
            "href": {
              "type": "string"
            }
          },
          "required": [
            "href"
          ]
        }
      },
      "required": [
        "self",
        "trust"
      ]
    }
  },
  "required": ["_links"],
  "anyOf": [
    {
      "required": ["individualBeneficiaries"]
    },
    {
      "required": ["employeeBeneficiaries"]
    },
    {
      "required": ["directorBeneficiaries"]
    },
    {
      "required": ["charityBeneficiaries"]
    },
    {
      "required": ["otherBeneficiaries"]
    }
  ],
  "definitions": {
    "address": {
      "type": "object",
      "properties": {
        "isNonUkAddress": {
          "type": "boolean"
        },
        "line1": {
          "type": "string"
        },
        "line2": {
          "type": "string"
        },
        "line3": {
          "type": "string"
        },
        "line4": {
          "type": "string"
        },
        "postalCode": {
          "type": "string"
        },
        "country": {
          "type": "string"
        }
      },
      "required": [
        "line1",
        "isNonUkAddress"
      ]
    },
    "individual": {
      "description": "Individual details",
      "type": "object",
      "properties": {
        "givenName": {
          "type": "string"
        },
        "otherName": {
          "type": "string"
        },
        "familyName": {
          "type": "string"
        },
        "dateOfBirth": {
          "type": "string"
        },
        "nino": {
          "type": "string"
        },
        "dateOfDeath": {
          "type": "string"
        },
        "passport": {
          "type": "object",
          "properties": {
            "identifier": {
              "type": "string"
            },
            "expiryDate": {
              "type": "string"
            },
            "countryOfIssue": {
              "type": "string"
            }
          },
          "required": [
            "identifier",
            "expiryDate",
            "countryOfIssue"
          ]
        },
        "correspondenceAddress": {
          "$ref": "#/definitions/address"
        },
        "telephoneNumber": {
          "type": "string"
        }
      },
      "required": [
        "givenName",
        "familyName",
        "dateOfBirth"
      ]
    },
    "individualBeneficiaries": {
      "type": "array",
      "items": {
        "type": "object",
        "properties": {
          "individual" : {"$ref": "#/definitions/individual"},
          "isVulnerable": {
            "type": "boolean"
          },
          "isIncomeAtTrusteeDiscretion": {
            "type": "boolean"
          },
          "shareOfIncome": {
            "type": "number"
          }
        },
        "required": [
          "individual",
          "isIncomeAtTrusteeDiscretion",
          "isVulnerable"
        ]
      }
    },
    "charityBeneficiaries": {
      "type": "array",
      "items": {
        "type": "object",
        "properties": {
          "name": {
            "type": "string"
          },
          "number": {
            "type": "string"
          },
          "correspondenceAddress": {
            "$ref": "#/definitions/address"
          },
          "isIncomeAtTrusteeDiscretion": {
            "type": "boolean"
          },
          "shareOfIncome": {
            "type": "number"
          }
        },
        "required": [
          "name",
          "number",
          "correspondenceAddress",
          "isIncomeAtTrusteeDiscretion"
        ]
      }
    },
    "otherBeneficiaries": {
      "type": "array",
      "items": {
        "type": "object",
        "properties": {
          "description": {
            "type": "string"
          },
          "correspondenceAddress": {
            "$ref": "#/definitions/address"
          },
          "isIncomeAtTrusteeDiscretion": {
            "type": "boolean"
          },
          "shareOfIncome": {
            "type": "number"
          }
        },
        "required": [
          "description",
          "correspondenceAddress",
          "isIncomeAtTrusteeDiscretion"
        ]
      }
    }
  }
}
