{
  "individualBeneficiaries": [
    {
      "individual": {
        "title": "Mr",
        "givenName": "Joe",
        "otherName": "Fred",
        "familyName": "Bloggs",
        "dateOfBirth": "3000-01-01",
        "nino": "WA123456A",
        "passport": {
          "identifier": "123435egxb",
          "expiryDate": "3000-01-01",
          "countryOfIssue": "UK"
        },
        "correspondenceAddress": {
          "isNonUkAddress": false,
          "line1": "Line 1",
          "line2": "Line 2",
          "line3": "Line 3",
          "line4": "Line 4",
          "postalCode": "NE1 2BR",
          "country": "UK"
        }
      },
      "isVulnerable": false,
      "isIncomeAtTrusteeDiscretion": true,
      "shareOfIncome": 30
    }
  ],
  "charityBeneficiaries": [
    {
      "name": "Charity Name",
      "number": "123456789087654",
      "correspondenceAddress": {
        "isNonUkAddress": false,
        "line1": "Line 1",
        "line2": "Line 2",
        "line3": "Line 3",
        "line4": "Line 4",
        "postalCode": "NE1 2BR",
        "country": "UK"
      },
      "isIncomeAtTrusteeDiscretion": false,
      "shareOfIncome": 20
    }
  ],
  "otherBeneficiaries": [
    {
      "description": "Beneficiary Description",
      "correspondenceAddress": {
        "isNonUkAddress": false,
        "line1": "Line 1",
        "line2": "Line 2",
        "line3": "Line 3",
        "line4": "Line 4",
        "postalCode": "NE1 2BR",
        "country": "UK"
      },
      "isIncomeAtTrusteeDiscretion": false,
      "shareOfIncome": 50
    }
  ],
  "_links": {
    "self": {
      "href" : "/trusts/2234567890/beneficiaries"
    },
    "trust": {
      "href" : "/trusts/2234567890"
    }
  }
}
